{
  "id": "talent.mystic.curses.dark_bargain",
  "kind": "talent_node",
  "displayName": "Dark Bargain",
  "displayNameKey": "talent.mystic.curses.dark_bargain.display_name",
  "descriptionKey": "talent.mystic.curses.dark_bargain.description",
  "treeId": "tree.mystic.curses",
  "tier": 1,
  "maxRank": 2,
  "pointCostPerRank": 1,
  "classification": "canonical",
  "abilityModifications": [
    {
      "abilityId": "ability.mystic.wither",
      "modifiers": [
        {
          "type": "ability_mana_cost_percent",
          "value": -0.1
        }
      ]
    },
    {
      "abilityId": "ability.mystic.evil_eye",
      "modifiers": [
        {
          "type": "ability_mana_cost_percent",
          "value": -0.1
        }
      ]
    }
  ]
}
