{
  "id": "talent.mystic.fateweave_r2",
  "kind": "talent_node",
  "displayName": "Fateweave R2",
  "displayNameKey": "talent.mystic.fateweave_r2.display_name",
  "descriptionKey": "talent.mystic.fateweave_r2.description",
  "treeId": "tree.mystic.class",
  "tier": 1,
  "maxRank": 1,
  "pointCostPerRank": 1,
  "classification": "canonical",
  "abilityModifications": [
    {
      "abilityId": "ability.mystic.fateweave",
      "modifiers": [
        {
          "type": "ability_damage_percent",
          "value": 0.25
        },
        {
          "type": "ability_heal_percent",
          "value": 0.25
        }
      ]
    }
  ]
}
