{
  "id": "talent.mystic.charms.mending_ward",
  "kind": "talent_node",
  "displayName": "Mending Ward",
  "displayNameKey": "talent.mystic.charms.mending_ward.display_name",
  "descriptionKey": "talent.mystic.charms.mending_ward.description",
  "treeId": "tree.mystic.charms",
  "tier": 2,
  "maxRank": 1,
  "pointCostPerRank": 1,
  "classification": "canonical",
  "passiveModifiers": [
    {
      "type": "shield_max_hp_heal_per_second",
      "value": 0.02
    }
  ]
}
