{
  "id": "talent.mage.frost.rimeguard",
  "kind": "talent_node",
  "displayName": "Rimeguard",
  "displayNameKey": "talent.mage.frost.rimeguard.display_name",
  "descriptionKey": "talent.mage.frost.rimeguard.description",
  "treeId": "tree.mage.frost",
  "tier": 2,
  "maxRank": 1,
  "pointCostPerRank": 1,
  "classification": "canonical",
  "conditionalModifiers": [
    {
      "conditions": [
        {
          "type": "owned_crowd_control"
        }
      ],
      "modifiers": [
        {
          "type": "damage_reduction_percent",
          "value": 0.08
        }
      ]
    }
  ]
}
