{
  "id": "talent.mystic.curses.wither_r3",
  "kind": "talent_node",
  "displayName": "Wither R3",
  "displayNameKey": "talent.mystic.curses.wither_r3.display_name",
  "descriptionKey": "talent.mystic.curses.wither_r3.description",
  "treeId": "tree.mystic.curses",
  "tier": 2,
  "maxRank": 1,
  "pointCostPerRank": 1,
  "classification": "canonical",
  "prerequisites": [
    {
      "nodeId": "talent.mystic.curses.wither_r2",
      "minRank": 1
    }
  ],
  "rankReplacement": {
    "nodeId": "talent.mystic.curses.wither_r2",
    "abilityId": "ability.mystic.wither"
  },
  "abilityModifications": [
    {
      "abilityId": "ability.mystic.wither",
      "modifiers": [
        {
          "type": "dot_reduces_target_damage_percent",
          "value": -0.1
        }
      ]
    },
    {
      "abilityId": "ability.mystic.malediction",
      "modifiers": [
        {
          "type": "dot_reduces_target_damage_percent",
          "value": -0.1
        }
      ]
    }
  ]
}
