{
  "id": "talent.mage.fire.flame_wave_r2",
  "kind": "talent_node",
  "displayName": "Flame Wave R2",
  "displayNameKey": "talent.mage.fire.flame_wave_r2.display_name",
  "descriptionKey": "talent.mage.fire.flame_wave_r2.description",
  "treeId": "tree.mage.fire",
  "tier": 3,
  "maxRank": 1,
  "pointCostPerRank": 1,
  "classification": "canonical",
  "prerequisites": [
    {
      "nodeId": "talent.mage.fire.flame_wave",
      "minRank": 1
    }
  ],
  "rankReplacement": {
    "nodeId": "talent.mage.fire.flame_wave",
    "abilityId": "ability.mage.flame_wave"
  },
  "abilityModifications": [
    {
      "abilityId": "ability.mage.flame_wave",
      "modifiers": [
        {
          "type": "on_hit_periodic_base",
          "value": 12
        },
        {
          "type": "on_hit_periodic_duration",
          "value": 3
        }
      ]
    }
  ]
}
