{
  "id": "talent.mystic.charms.battle_blessing",
  "kind": "talent_node",
  "displayName": "Battle Blessing",
  "displayNameKey": "talent.mystic.charms.battle_blessing.display_name",
  "descriptionKey": "talent.mystic.charms.battle_blessing.description",
  "treeId": "tree.mystic.charms",
  "tier": 1,
  "maxRank": 1,
  "pointCostPerRank": 1,
  "classification": "canonical",
  "abilityModifications": [
    {
      "abilityId": "ability.mystic.fateweave",
      "modifiers": [
        {
          "type": "after_mend_next_harm_percent",
          "value": 0.25
        }
      ]
    }
  ]
}
